{
  "capabilities": [
    "chat",
    "image-understanding",
    "text-generation",
    "video-understanding"
  ],
  "dependencies": [],
  "files": [
    {
      "id": "metadata-63db53e79ebe-618cd5b83d",
      "path": ".gitattributes",
      "roles": [
        "metadata"
      ],
      "sha256": "63db53e79ebe156cf7cab50fb2d6f62f023892795286497f1f44832825741d11",
      "size_bytes": 1671
    },
    {
      "id": "license-fa4d54e7b8a1-83a544517d",
      "path": "LICENSE.pdf",
      "roles": [
        "metadata"
      ],
      "sha256": "fa4d54e7b8a1be9a606bc82964b026d525749978bfadf50f239bd520ce82eebc",
      "size_bytes": 76728
    },
    {
      "id": "readme-413650e4ed6a-b335630551",
      "path": "README.md",
      "roles": [
        "metadata"
      ],
      "sha256": "413650e4ed6a3b6b3c898017d0623c6ec0c94cac14e50a98ad0f5bdf9ec0ca78",
      "size_bytes": 16155
    },
    {
      "id": "added-tokens-58b54bbe36fc-dec41b9537",
      "path": "added_tokens.json",
      "roles": [
        "tokenizer"
      ],
      "sha256": "58b54bbe36fc752f79a24a271ef66a0a0830054b4dfad94bde757d851968060b",
      "size_bytes": 605
    },
    {
      "id": "chat-template-a0bc6f6fc7a2-00824420d1",
      "path": "chat_template.jinja",
      "roles": [
        "tokenizer"
      ],
      "sha256": "a0bc6f6fc7a29a80017a433e8f03a1cc1236e838a944a2d034295a60c4f2fddb",
      "size_bytes": 1017
    },
    {
      "id": "config-776d24a29b93-587cb980af",
      "path": "config.json",
      "roles": [
        "configuration"
      ],
      "sha256": "776d24a29b93554610fb7a10e429a71cd49ed85d39fc2f7ad984a5febf089411",
      "size_bytes": 4588
    },
    {
      "id": "generation-config-bc068f56ab9b-97dd3d578b",
      "path": "generation_config.json",
      "roles": [
        "configuration"
      ],
      "sha256": "bc068f56ab9b6eb5eec7a27ab284fae6fd25c0752e2d0e6e8fd7916eecffe43a",
      "size_bytes": 214
    },
    {
      "id": "hf-quant-config-7ffe2f63dcdb-a481ad90fa",
      "path": "hf_quant_config.json",
      "roles": [
        "configuration"
      ],
      "sha256": "7ffe2f63dcdb6e58dc4cd58cb5d8e18d4c8508a3332589e0b66caf67742e38ab",
      "size_bytes": 318
    },
    {
      "id": "merges-8831e4f1a044-b0d6dcfed4",
      "path": "merges.txt",
      "roles": [
        "metadata"
      ],
      "sha256": "8831e4f1a044471340f7c0a83d7bd71306a5b867e95fd870f74d0c5308a904d5",
      "size_bytes": 1671853
    },
    {
      "id": "model-00001-of-00002-e1fd4af01e69-27a6880801",
      "path": "model-00001-of-00002.safetensors",
      "roles": [
        "weights"
      ],
      "sha256": "e1fd4af01e69b84b090e830bf687f83576ef5b7eca1da60f377cf7e83ae074fc",
      "size_bytes": 4989051872
    },
    {
      "id": "model-00002-of-00002-b67d3920398d-2cca3b5a88",
      "path": "model-00002-of-00002.safetensors",
      "roles": [
        "weights"
      ],
      "sha256": "b67d3920398db4ad78f0816d0bdf3887fc2174240ee42ad85992cf32cf332802",
      "size_bytes": 2215324648
    },
    {
      "id": "model-safetensors-index-7192522e412c-0a05be8238",
      "path": "model.safetensors.index.json",
      "roles": [
        "configuration"
      ],
      "sha256": "7192522e412c3700695fc69fcfb3acc1e7b5e1bc7da1d7a5834a19acb4e3b160",
      "size_bytes": 109048
    },
    {
      "id": "preprocessor-config-276e1dbe46dd-36afccab5d",
      "path": "preprocessor_config.json",
      "roles": [
        "configuration"
      ],
      "sha256": "276e1dbe46dd567fce6e587665266ede535f42ab08d46f3d7febea17cb37abcd",
      "size_bytes": 791
    },
    {
      "id": "special-tokens-map-a4c29a7f6314-c07a9be597",
      "path": "special_tokens_map.json",
      "roles": [
        "tokenizer"
      ],
      "sha256": "a4c29a7f63146cb43eef20b92caab0e2a5000d13d4dc9cd29888bbfad8059466",
      "size_bytes": 388
    },
    {
      "id": "tokenizer-9c5ae00e602b-224931eb13",
      "path": "tokenizer.json",
      "roles": [
        "tokenizer"
      ],
      "sha256": "9c5ae00e602b8860cbd784ba82a8aa14e8feecec692e7076590d014d7b7fdafa",
      "size_bytes": 11421896
    },
    {
      "id": "tokenizer-config-60f6e7bc948c-94d5c6ba8f",
      "path": "tokenizer_config.json",
      "roles": [
        "tokenizer"
      ],
      "sha256": "60f6e7bc948cedd377a20f01d022ef664d026fbc93d72e0a9bdac233f8632181",
      "size_bytes": 4689
    },
    {
      "id": "video-preprocessor-config-2e82d384445c-35d01a7325",
      "path": "video_preprocessor_config.json",
      "roles": [
        "configuration"
      ],
      "sha256": "2e82d384445cd3056b851d36b6481b9a9df99362b85e9d666317c1f0331fc6aa",
      "size_bytes": 935
    },
    {
      "id": "vocab-ca10d7e9fb3e-ba05d8e2e4",
      "path": "vocab.json",
      "roles": [
        "tokenizer"
      ],
      "sha256": "ca10d7e9fb3ed18575dd1e277a2579c16d108e32f27439684afa0e10b1440910",
      "size_bytes": 2776833
    }
  ],
  "format": {
    "precision": "fp4",
    "quantization": "nvfp4-modelopt"
  },
  "identity": {
    "family": {
      "publisher": "qwen",
      "slug": "qwen",
      "title": "Qwen"
    },
    "model": {
      "publisher": "nvidia",
      "slug": "qwen2-5-vl-7b-instruct",
      "title": "Qwen2.5-VL 7B Instruct"
    },
    "publisher": "nvidia",
    "slug": "qwen2-5-vl-7b-instruct-nvfp4-d13bb1f2",
    "variant": "NVFP4 d13bb1f2",
    "version": "NVFP4 d13bb1f2"
  },
  "kind": "model",
  "license": {
    "attribution": [
      "NVIDIA Corporation",
      "Alibaba Qwen"
    ],
    "spdx": "LicenseRef-NVIDIA-Open-Model-License",
    "url": "https://www.nvidia.com/en-us/agreements/enterprise-software/nvidia-open-model-license/"
  },
  "metadata": {
    "description": "Exact public NVIDIA Model Optimizer NVFP4 quantization of Qwen2.5-VL-7B-Instruct.",
    "tags": [
      "nvidia",
      "qwen",
      "language",
      "vision",
      "nvfp4",
      "candidate"
    ]
  },
  "modalities": [
    "image",
    "text",
    "video"
  ],
  "requires_token": false,
  "source": {
    "repository": "https://huggingface.co/nvidia/Qwen2.5-VL-7B-Instruct-NVFP4",
    "revision": "d13bb1f2d8fbbd9f16cbb7688c8d6b6932d797d7"
  }
}
